Id_wisata,Nama Wisata,Deskripsi,Jenis Wisata,Lokasi,Ratings,TAG,Harga Tiket
1,HUTAN LINDUNG SUNGAI WAIN (HLSW),Hutan Lindung Sungai Wain (HLSW) merupakan salah satu objek wisata alam yang berada di Jalan Soekarno-Hatta Kecamatan Balikpapan Utara. HLSW adalah perpaduan objek wisata Hutan dan Sungai. Hutan itu sendiri terdiri dari hutan primer (hutan asli) dan hutan sekunder (hutan buatan) sebagai hutan pengganti yang terbakar pada tahun 1997/1998.,WISATA ALAM,Kota Balikpapan,4.6,pemandangan alam,15000
2,KAWASAN WISATA PENDIDIKAN LINGKUNGAN HIDUP (KWPLH),Kawasan Wisata Pendidikan Lingkungan Hidup (KWPLH) terletak di Km.23 Jalan raya Balikpapan-Samarinda. Kawasan ini merupakan kawasan konservasi Beruang Madu atau yang dikenal dengan nama ilmiah “Helarctos Malayanus” . Hewan ini tergolong salah satu satwa yang dilindungi didunia. KWPLH memiliki 5 (lima) ekor beruang madu yang kesemuannya merupakan beruang yang pernah ditangkap dan dikomersialisasikan oleh pihak-pihak yang tidak bertanggungjawab.,WISATA ALAM,Kota Balikpapan,4,pemandangan alam,Gratis
3,MANGROVE CENTER GRAHA INDAH,Hutan Mangrove Graha Indah merupakan wilayah konservasi pohon bakau dan satwa endemik Kalimantan. Destinasi wisata disini akan memberikan pengalaman yang berbeda dari objek wisata biasanya. Daya tarik utama yang bisa Anda dapatkan ketika mengunjungi Graha Indah Hutan Mangrove ialah fasilitas menaiki perahu untuk menyusuri Sungai Somber. Di sepanjang perjalanan Anda akan disuguhkan panorama hijaunya pemandangan hutan mangrove sejauh mata memandang. Di sana Anda juga akan melihat beberapa hewan endemik Kalimantan yakni Bekantan. Hal inilah yang juga menjadi daya tarik utama Hutan Mangrove Graha Indah.,WISATA ALAM,Kota Balikpapan,4.5,mangrove,15000
4,KEBUN RAYA BALIKPAPAN (KRB),Kebun Raya Balikpapan merupakan salah satu objek wisata di kota Balikpapan. Pemerintah Kota Balikpapan bekerjasama dengan Pusat Konservasi Tumbuhan Kebun Raya Bogor dan Balai Besar Penelitian Dipterocarpaceae Dephut untuk kegiatan pembangunan Kebun Raya Balikpapan. Keberadaan Kebun Raya Balikpapan terletak di Kawasan Hutan Lindung Sungai Wain,WISATA ALAM,Kota Balikpapan,4.5,Kebun Binatang,15000
5,MANGROVE MARGO MULYO,"Hutan mangrove merupakan hutan buatan yang bisa sebagai tempat tinggal yang cocokntuk flora dan fauna asli Kalimantan. Memiliki habitat asli membuat para hewan serta tumbuhan ini dapat berkembang dengan sangat baik. Sehingga para pengunjung dapat berjumpa langsung. Salah satu hewan yang sering muncul, yaitu Bekantan yang jadi spesies asli Kalimantan.",WISATA ALAM,Kota Balikpapan,4.2,Mangrove,15000
6,KAWASAN EKOWISATA TELUK BALIKPAPAN,"Teluk Balikpapan adalah kawasan padat objek wisata yang terletak di Provinsi Kalimatan Timur, tepatnya sebelah utara Kota Balikpapan dan sebelah barat Kabupaten Penajam Paser Utara. Disana terdapat Keindahan jembatan Balangan membentang di atas teluk yang menghubungkan Panajam Paser Utara dan Balikpapan . Banyaknya jenis ikan yang ada di Teluk Balikpapan juga bisa menjadi area memancing bagi wisatawan.",WISATA ALAM,Kota Balikpapan,4,Pemandangan alam,15000
7,EKOWISATA MANGROVE KARIANGAU,"Hutan Mangrove Center Kariangau menyewakan perahu klotok untuk berkeliling menyusuri sungai Somber selama 1 jam bolak-balik dan tentunya ditemani oleh tur guide. Untuk menyewa perahu dihargai sekitar Rp. 300 ribu per perahu (*) bisa di isi sampai 10 orang. Kita bisa melihat bekantan yang jumlahnya cukup banyak, terutama saat menjelang sore, banyak tampak keluarga bekantan yang keluar mencari makan di pucuk pohon Mangrove yang menjulang. kanan kiri rimbun hutan mangrove,",WISATA ALAM,Kota Balikpapan,4.5,Mangrove,15000
8,PENANGKARAN BUAYA TERITIP,Di penangkaran buaya ini pengunjung bisa menikmati sensasi memberi makan buaya. Pengunjung bisa membeli ayam yang disediakan di sini kemudian menuju ke rawa buatan untuk melemparkan ayam yang akan disambut oleh buaya-buaya lapar.,WISATA BUATAN,Kota Balikpapan,4.1,Kebun Binatang,20000
9,CARRIBEAN ISLAND WATERPARK REGENCY,"CARIBBEAN Waterpark Balikpapan menawarkan konsep taman air berbeda. Mengusung tema kepulauan Karibia, water park yang sangat cocok sebagai destinasi rekreasi keluarga. Menawarkan beragam keseruan di berbagai wahana permainan air dan kolam.",WISATA BUATAN,Kota Balikpapan,4.2,Kolam berenang,50000
10,WATERPARK GRIYA PERMATA ASRI,Waterpark dekat dengan pusat kota,WISATA BUATAN,Kota Balikpapan,3,Kolam Berenang,60000
11,JEMBATAN ULIN KARIANGAU,jembatan kayu ulin sepanjang lebih kurang 800 meter dan lebar 2 meter ini bisa menyaksikan hilir mudik kapal fery dari pelabuhan Kariangau ke Penajam Paser Utara dan sebaliknya.,WISATA BUATAN,Kota Balikpapan,3,Jembatan,Gratis
12,KAMPUNG ATAS AIR MARGASARI,"Daerah kampung ini terbilang sangat bersih dengan jembatan kayu ulin yang menjadi jalan utama dari kampung. Sementara di bagian kiri dan kanan kayu ulin tersebut terdapat beberapa aliran air laut yang menggenang. Meskipun demikian, warga pun senantiasa menjaga kebersihan kampung atas air mereka dengan melakukan kerja bakti pada hari hari tertentu.",WISATA BUATAN,Kota Balikpapan,4.4,Kampung,Gratis
13,KAMPUNG WARNA WARNI TELUK SERIBU,"Di sini, seluruh rumah-rumah bercat beraneka ragam warna sampai ke atap-atapnya. Selain mengecat rumah, seniman juga membuat lukisan 3 dimensi di dinding sepanjang 100 meter. Dinding ini terletak di sepanjang jalan menuju ke perkampungan. Meski sudah ada, hal yang membedakan dengan yang lain yaitu jalur aksesnya. Untuk sampai ke sini, pengunjung harus menyusuri Teluk Seribu. Selain itu, tak jauh dari perkampungan terdapat juga hutan mangrove dengan habitat bekantan yang masih asli.",WISATA BUATAN,Kota Balikpapan,4.1,Kampung,3000
14,AQUA BOOM,Satu-satunya waterpark yang dibangun di atas gedung bertingkat di Indoesia,WISATA BUATAN,Kota Balikpapan,4.2,Kolam berenang,95000
15,TAMAN BEKAPAI,"Taman Bekapai adalah salah satu tempat yang sangat cocok untuk dijadikan tempat bersantai. Suasana sejuk dan rindang di tengah kesibukan kota ini mampu membuatmu melupakan masalah sejenak, sembari memulihkan tenaga yang telah hilang saat sibuk bekerja.",WISATA BUATAN,Kota Balikpapan,4.3,Taman,Gratis
16,TAMAN TIGA GENERASI,"Taman Tiga Generasi ini mendukung beragam kegiatan yang dapat dilakukan. Adapun Anda tidak akan di buat bingung melakukan banyak hal selama berkunjung. Perlu diketahui bahwa ada beberapa fasilitas untuk bermain anak-anak. Misalnya papan perosotan, ayunan dan lain-lain. ",WISATA BUATAN,Kota Balikpapan,4.5,Taman,Gratis
17,WADUK MANGGAR,Waduk Manggar di Balikpapan merupakan danau buatan dengan keindahan alam yang tersaji mampu menghipnotis pengunjung untuk berlibur atau sekedar bersantai saat akhir pekan.,WISATA BUATAN,Kota Balikpapan,4.9,Waduk,5000
18,KAMPOENG KENANGAN,"Lokasinya dirancang secara unik penuh warna-warni dengan konsep nuansa zaman dahulu, pengunjung akan merasa puas mendapat gambar kenangan yang indah di lokasi Wisata Kampung Kenangan.",WISATA BUATAN,Kota Balikpapan,4,Kampung,Gratis
19,KAMPUNG PINISI,"Pengunjung akan merasakan suasana asri yang menampilkan rumah dengan cat warna-warni. Beragam mural atau lukisan dinding menghiasi dinding sejumlah rumah, ketika memasuki gang pemukiman.",WISATA BUATAN,Kota Balikpapan,4.5,Kampung,15000
20,KAMPUNG KANGKUNG,"Kampung Wisata Kang Bejo merupakan tempat kunjungan wisata pertama memberikan edukasi tentang makanan di Balikpapan. Tempat ini memiliki daya tarik yang unik dan khas, dapat dinikmati sembari menambahkan nilai dan manfaat. Meski kangkung bukan sayuran khas daerah Balikpapan, namun tumbuhan yang dapat diolah dengan beragam ini mampu membawa daya tarik pengunjung hingga Kampung Kang Bejo terkenal akan kangkungnya. Kreativitas kampung wisata ini sudah terlihat dari pemberian namanya “Kang Bejo” yang berarti “Kangkung Sumber Rejo”. Kangkung digunakan sebagai nama dari tempat ini karena merupakan komoditas utama yang diproduksi di Kampung Wisata ini. Terlihat adanya keunikan dan khas suatu nama makanan yang dikombinasi dengan lokasi wisata itu sendiri.",WISATA BUATAN,Kota Balikpapan,4.6,Kampung,Gratis
21,GIFTA GARDEN,"Gifta Garden dikelilingi bangunan restoran berbentuk lamin, sepanjang perjalanan di sisi kanan-kiri lahan berwarna hijau itu ditanami aneka pohon, buah, serta bunga. Membuat pengunjung diajak lebih dekat dengan alam terbuka. Sekaligus mendapat edukasi, dengan mengenal flora dan fauna.  Gifta Garden banyak wahana-wahana yang ditawarkan ke pengunjung antara lain pertama ada restoran dengan makanan yang sederhana seperti soto, pecel, rawon dan sebagainya. Kemudian di sana ada pengembangbiakan tanaman hidroponik selada, sawi, kangkung dan lain sebagainya.",WISATA BUATAN,Kota Balikpapan,4.3,Agrowisata,50000
22,ISLAMIC CENTER,"Masjid Islamic Center Balikpapan. Masjid ini juga dikenal sebagai Masjid Madinatul Iman. Tak dapat dipungkiri, ini masjid terbaru, terbesar, dan termegah di Balikpapan, mengalahkan masjid termegah sebelumnya, Masjid Agung At Taqwa. Masjid berlokasi di Jl. Belibis Raya, Gn Bahagia, Balikpapan Selatan, berjarak sekitar 12 km dari pusat kota, arah Timur Laut.",WISATA RELIGI,Kota Balikpapan,4.8,Tempat Ibadah,Gratis
23,MAHAVIHARA BUDDHA MANGGALA,"Berwisata ke Mahavihara Buddha manggala seperti berlibur ke Thailand. Terdapat patung gajah putih dan patung Budda tertidur. Sementara di sisi lain, terdapat patung Kinara Kinari, stupa seperti yang ada di Candi Borobudur, dan lain sebagainya Lokasinya berada di pusat kota Batu Ampar Balikpapan. Namun, lantaran tempat ini masih digunakan sebagai peribadatan, sebaiknya siapapun yang berkunjung harus mentaati dan menghormati peraturan yang ada di dalamnya. ",WISATA RELIGI,Kota Balikpapan,4.6,Tempat Ibadah,Gratis
24,MASJID JAMI AL'ULA,"Masjid ini berlokasi di Jalan Letjen Suprapto RT 15 No 1 Kelurahan Baru Ulu Balikpapan Barat. Berada di kawasan pemukiman yang didiami mayoritas warga Bugis – Makassar. Masjid ini sebagai tonggak sejarah penyebaran agama Islam di Balikpapan. Seperti namanya, ""Ula"" berarti pertama atau awal. Ia merupakan bangunan pertama tempat ibadah umat Islam di Balikpapan.",WISATA RELIGI,Kota Balikpapan,4.8,Tempat Ibadah,Gratis
25,MASJID AGUNG AT TAQWA,"Masjid ini adalah salah satu masjid termegah di Kalimantan Timur. Kompleks masjid terdiri dari tiga lantai. Di Lantai 2 terdapat bangunan utama seluas 5.268 m2 dengan kapasitas tak kurang dari 4 ribu orang. Sedangkan bangunan penunjang seluas 4.426 m2.
Pada lantai dasar, bangunan utama seluas 2.004 m2, terdapat tempat penitipan barang dan tempat wudhu. Ada juga aula dan panggung yang kerap digunakan sebagai resepsi akad nikah. Lantai dasar dapat menampung 800 jamaah.
Lantai 2 adalah lantai utama masjid. Ruang imam, perpustakan dan gudang peralatan tersedia. Dengan luas 1.632 m2, lantai utama dapat menampung seribu orang. Pada lantai 3 terdapat void dengan desain dan perpaduan warna yang sangat menarik. Selain itu terdapat perpustakaan dan ruang untuk pengajar TK-TPA At-Taqwa. Lantai ini dapat menampung tidak lebih 700 jama’ah. ",WISATA RELIGI,Kota Balikpapan,4.8,Tempat Ibadah,Gratis
26,MASJID ISTIQOMAH,"Mesjid Itiqomah memiliki daya tarik tersendiri Antara lain studio radio dakwah IDC FM, perpustakaan, guest house hingga pusat pendidikan agama Islam. Masjid ini terletak sangat strategis yaitu hanya beberapa meter dari Lapangan Merdeka yang menjadi salah satu pusat kegiatan masyarakat Balikpapan. Masjid ini juga dikelilingi lokasi wisata menarik seperti Pantai Kemala, Pantai Kilang Mandiri, dan Tugu Australia.",WISATA RELIGI,Kota Balikpapan,4.9,Tempat Ibadah,Gratis
27,KLENTENG GUANG DE MIAO,"Kelenteng Guang De Miao terletak di Jl. Bukit Niaga, Klandasan Ilir, Balikpapan Selatan, atau lebih mudahnya terletak di daerah Pasar Baru Balikpapan. Kelenteng Guang De Miao sendiri dapat dikatakan sangat bersejarah, kelenteng tersebut sudah berdiri pada tahun 1915, yang mana saat ini sudah berusia 106 tahun. ",WISATA RELIGI,Kota Balikpapan,4.5,Tempat Ibadah,Gratis
28,PONDOK PESANTREN HIDAYATULLAH,"Hidayatullah awalnya sebuah pondok pesantren yang berdiri di atas lahan wakaf seluas 120 hektar di Gunung Tembak, Balikpapan, Kalimantan Timur. Hidayatullah ini didirikan oleh Ust Abdullah Said ",WISATA RELIGI,Kota Balikpapan,4.5,Tempat Ibadah,Gratis
29,VIHARA EKA DHARMA MANGGALA,"Wisata religi di Vihara Eka Dharma Manggala Kendari, bisa melihat panorama Teluk Kendari dari ketinggian.
Dari tempat peribadatan umat Budha ini, dapat saksikan Teluk Kendari yang membentang luas dengan pemandangan aktivitas kapal yang melintas.
Bangunan Vihara itu berhadapan langsung ke Teluk Kendari.",WISATA RELIGI,Kota Balikpapan,4.8,Tempat Ibadah,Gratis
30,VIHARA BUDDHA MAITREYA,"Berada di lantai III dengan ukuran 96 x 38 meter, merupakan gedung Baktisala Maitreya sekaligus ruang bakti puja utama yang berkapasitas 2.500 orang. Saat Anda melihat Pratima Buddha Maitreya setinggi 6,8 meter yang penuh tawa ria, terasa seisi ruangan penuh dengan hawa kedamaian, kebahagiaan, dan kesukacitaan, serta akan merasakan betapa manusia itu amat kecil dan papa dihadapan Buddha Maitreya yang Maha Suci dan Sempurna.",WISATA RELIGI,Kota Balikpapan,4.8,Tempat Ibadah,Gratis
31,MASJID CENG HO,"Keberadaan Masjid Muhammad Cheng Hoo yang tepat berada di pintu masuk Pantai Lamaru , tanpa disadari kehadirannya dianggap menjadi destinasi wisata religi. Konsep design yang unik, banyak dijadikan spot selfie oleh warga, baik selepas menunaikan salat maupun saat akan berkunjung ke Pantai Lamaru. Dengan desain yang bagus, dengan konsep China, sehingga dapat di katakan mesjid ini  menjadi salah satu destinasi tambahan wisata religi yang terdapat di Kota Balikpapan",WISATA RELIGI,Kota Balikpapan,4.8,Tempat Ibadah,Gratis
32,GEREJA KATOLIK SANTA MARIA,"Gereja Katolik Santa Maria merupakan salah satu gereja Katolik di Kota Balikpapan. Gereja bagi persekutuan jemaat katolik ini menyediakan tempat ibadah untuk ibadah rutin minggu pagi - sore, ibadah misa, Paskah, kamis putih, baptis (pembaptisan), Natal hingga Jumat Agung.
Gereja Katolik Santa Maria memiliki ciri khas bangunan yang sejuk dengan sejarah gereja katolik di Kota Balikpapan yang kuat sehingga menjadi tempat ibadah bagi ummat katolik Kota Balikpapan.",WISATA RELIGI,Kota Balikpapan,4.6,Tempat Ibadah,Gratis
33,PANTAI MANGGAR SEGARA SARI,"Pantai Manggar Segara Sari memilikii banyak daya tarik dengan estimasi keindahan hamparan laut beserta pasir putihnya membuat pengunjung menjadi betah untuk berlama-lama di tempat ini. Oleh karenanya jika waktu liburan tiba maka bisa dipastikan jika ribuan orang berbondong-bondong untuk berlibur kesana.
Selain itu, daya tarik lain yang dimiliki oleh Pantai Segara Sari juga cukup banyak sehingga sangat direkomendasikan bagi Anda untuk menyempatkan waktu pergi ke tempat ini. Juga dengan pemandangan air laut yang jernih dan bersih. Gelombangnya pun bisa dikatakan sedang-sedang saja jadi tidak membahayakan jika didekati. Dengan begitu semua pengunjungnya bisa merasakan sensasi bermain air laut di bibir pantai.",WISATA BAHARI,Kota Balikpapan,4.2,Pantai,7000
34,PANTAI LAMARU,"Pantai initerletak di Desa Teritip, tepatnya di Jalan Mulawarman, Lamaru ini ternyata memiliki pesona yang sangat mengagumkan. Pantai Lamaru merupakan salah satu pantai yang landai sehingga anda pun akan lebih nyaman untuk berwisata ke pantai satu ini. Tak hanya itu saja, pasir putih yang terdapat di pantai satu ini pun juga dapat menjadi daya tarik tersendiri bagi wisatawan. Sehingga dengan adanya bibir pantai yang luas tersebut akan bisa dimanfaatkan untuk berbagai aktifitas pantai yang lain. Sebut saja seperi untuk bermain voli pantai, bermain bola ataupun bermain pasir dan membuat istana pasir. Pastinya hal tersebut akan membuat liburan anda bersama keluarga semakin berkesan dengan berwisata di Pantai Lamaru ini.",WISATA BAHARI,Kota Balikpapan,4.4,Pantai,20000
35,PANTAI MONPERA,"Pantai monpera adalah salah satu pantai yang cukup populer di wilayah Balikpapan. Pantai ini memiliki daya tarik dan cerita tersendiri bagi masyarakat di Balikpapan. Di pantai ini terdapat tugu peringatan yang biasa disebut Monumen Perjuangan Rakyat (Monpera). Pantai Monpera menawarkan pemandangan berupa hamparan pasir pantai yang berwarna kecoklatan, berpadu dengan indahnya panorama alam sekitar pantai.",WISATA BAHARI,Kota Balikpapan,4.3,Pantai,3000
36,PANTAI KEMALA,"Pantai dengan panorama dekat pusat kota, yang memiliki air laut warna biru dan terlihat  fresh. Disamping itu, ada panorama berbentuk beberapa kapal tanker besar yang berlalu lalang membawa muatan. Anda juga dapat menyaksikan kapal tanker itu bila kapal itu sedang melalui lautan walaupun anda hanya  di teritori pantai.",WISATA BAHARI,Kota Balikpapan,4.3,Pantai,5000
37,PANTAI KILANG PERTAMINA,"Pantai Kilang Pertamina terletak di Jalan Jenderal Sudirman. Pemandangannya yang indah menjadi daya tarik utama pantai ini.  Begitu memasuki kawasan pantai, maka akan disambut dengan deretan payung etnik dan bean bag berwarna-warni yang berjajar rapi di atas pasir putih. Ketika hari beranjak senja, lampu-lampu hias di pantai akan mulai dinyalakan. Suasana pantai pun menjadi semakin romantis dan menyenangkan. Sambil menikmati semilir angin laut dan debur ombak sambil menyantap aneka kuliner yang dijual di pantai ini. Fasilitas di pantai ini juga sudah cukup lengkap, mulai dari toilet umum sampai lahan parkir.",WISATA BAHARI,Kota Balikpapan,4.5,Pantai,5000
38,PANTAI SERAYA,"Pantai seraya terletak di RT 28, Kelurahan Sepinggan Raya, Kecamatan Balikpapan Selatan. Fasilitas yang ada di kawasan wisata Pantai Seraya ini tersedia puluhan perahu kayu yang dapat disewa oleh pengunjung. Selain itu, di kawasan pantai seraya ini juga tersedia sejumlah kuliner.
Di antaranya sop singkong, bakso, ayam lalapan, ikan bakar, warung kopi, dan sejumlah kuliner lainnya.
Menariknya, di Pantai Seraya ini masyarakat dapat langsung memeroleh ikan segar yang masih hidup, sehingga mutu kesegarannya sangat terjamin.",WISATA BAHARI,Kota Balikpapan,4.4,Pantai,5000
39,PANTAI BATU-BATU BANUA PATRA,"Pantai ini menyuguhkan keindahan kontras dari warna pasir dan lautannya.  Tampilan pasir yang putih cemerlang dan halus, dan dipenuhi dengan bebatuan alam yang tersusun sampai membentuk pulau dipinggir pantai. Bebatu yang terbentuk secara alami ini bisa dijadikan spot menarik untuk diabadikan.",WISATA BAHARI,Kota Balikpapan,4.5,Pantai,5000
40,PANTAI NIRMALA/SMACLY,"Pantai Nirmala yang berlokasi di Kelurahan Lamaru, Kecamatan Balikpapan Timur, Kota Balikpapan, Provinsi Kalimantan Timur. Fasilitas dan fitur di Pantai Nirmala sudah melimpah sehingga ramai pengunjung. Pantai Nirmala cocok buat semua, bagi warga Kota Balikpapan maupun luar Kota Balikpapan.",WISATA BAHARI,Kota Balikpapan,4.5,Pantai,5000
41,PANTAI DAMBA ENGGANG,"Pantai Wisata Damba Enggang Borneo terletak di kawasan pesisir Stal Kuda atau lebih tepatnya di Jalan Jenderal Sudirman, Stal Kuda, Kelurahan Gunung Bahagia. Di pantai tersebut pengunjung akan disuguhkan dengan pemandangan elok.
Dominasi batu karang buatan yang ditumbuhi pohon mangrove jenis api-api semakin sedap ketika dipandang mata. Di sore hari sunset terlihat binar. ada banyak spesies terumbu karang seperti terumbu karang darah, terumbu karang otak, terumbu karang tulang, terumbu karang payung dan juga ada ikan clownfish atau ikan nemo.",WISATA BAHARI,Kota Balikpapan,4.5,Pantai,5000
42,TUGU MAKAM JEPANG,"Di monumen ini terdapat satu lubang kuburan massal bagi 300 tentara Jepang. Selain itu,  terdapat juga beberapa gazebo bertuliskan bahasa Jepang. Monumen ini sebagai pengingat sejarah pada masyarakat untuk kepentingan pendidikan dan wisata.
Selain menyimpan peristiwa bersejarah, musium ini juga menjadi objek wisata di Kota Balikpapan yang dapat dimanfaatkan untuk berlibur bersama keluarga dan teman.",WISATA SEJARAH,Kota Balikpapan,4.1,Sejarah,Gratis
43,TUGU AUSTRALIA,"Tugu Australia ini sebagai tanda bahwa di areal tugu dulunya terdapat makam dari 225 tentara Australia yang membantu pembebasan Kota Tarakan dari kolonialisme Jepang. Namun pada akhirnya semua makam dari tentara Australia tersebut dipindahkan ke negaranya Australia. Di Tugu Australia ini juga terdapat perjanjian yang isinya tentang perjuangan yang gagah berani tentara Australia dari divisi angkatan darat, laut dan udara yang membantu mengalahkan tentara Jepang di Kota Tarakan.",WISATA SEJARAH,Kota Balikpapan,4.3,Sejarah,Gratis
44,MUSEUM KODAM VI MULAWARMAN,"Museum Kodam VI/Mulawarman adalah sebuah kawasan konservasi milik TNI AD. Museum ini menyediakan informasi sejarah mengenai kota Balikpapan, seperti beberapa peralatan perang yang pernah dipakai, foto-foto kota Balikpapan tempo dulu, dan beberapa benda berharga di bidang militer.",WISATA SEJARAH,Kota Balikpapan,4.4,Sejarah,Gratis
45,MONUMEN MATHILDA,Monumen Mathilda ini dibangun karena sebuah peristiwa bersejarah yang ada di Balikpapan yaitu mengenai pengeboran minyak yang cukup menghebohkan pada saat itu. pengeboran tersebut terjadi pada tahun 1897. Ini merupakan pengeboran yang besar yang pertama kali terjadi di Balikpapan.,WISATA SEJARAH,Kota Balikpapan,4.3,Sejarah,Gratis
46,MERIAM JEPANG," Di Kabupaten Penajam Paser Utara (PPU), terdapat meriam legendaris peninggalan tentara Jepang. Meriam tersebut kini dijadikan objek wisata ataupun tempat berswafoto anak muda. Pada zaman pendudukan Jepang, meriam itu berfungsi sebagai benteng pertahanan di wilayah Penajam (dulu Balikpapan Seberang). Moncong meriam itu mengarah ke laut Balikpapan. Bertujuan untuk mengganggu kapal-kapal di laut Balikpapan pada masanya.",WISATA SEJARAH,Kota Balikpapan,4.4,Sejarah,Gratis
47,RUMAH DAHOR HERITAGE,"Dahor Heritage adalah rumah panggung yang menjadi salah satu cagar budaya yang terletak di jalan Letjen Suprapto kota Balikpapan. Rumah ini menjadi bagian dari kompleks perumahan yang dikelola langsung oleh Pertamina karena menjadi saksi bisu cerita para pekerja kilang minyak pada masa kolonial Belanda. Dimana, kemudian rumah antik ini dijadikan sebagai museum ataupun perpustakaan. Menjadi salah satu wisata edukasi yang menarik, rumah ini ramai dikunjungi wisatawan.",WISATA SEJARAH,Kota Balikpapan,4.4,Sejarah,Gratis
48,MERIAM JEPANG SIDODADI,"Meriam  jepang ini  merupakan  peninggalan  Kaigun,  Angkatan  Laut  Jepang pada masa PD II yang dilindungi oleh Undang-Undang. Meriam Jepang ini dulunya digunakan sebagai senjata pertahanan pihak jepang terhadap pihak belanda dalam merebutkan wilayah sumur minyak yang berada di kota balikpapan.  Meriam ini juga menggambarkan bahwa Kota Balikpapan pada saat Perang Dunia II merupakan tempat yang strategis untuk pertahanan.",WISATA SEJARAH,Kota Balikpapan,4.3,Sejarah,Gratis
49,TUGUH PERINGATAN PERDAMAIAN INDONESIA - JEPANG - AUSTRALIA,"Tugu Perdamaian Jepang, Australia dan Indonesia adalah sebuah situs cagar budaya bersejarah yang ada di Kota Balikpapan dan merupakan salah satu situs yang menjadi saksi sejarah perjuangan kemerdekaan Indonesia pada Perang Dunia II 1945.
Lokasi Tugu Perdamaian Jepang, Australia dan Indonesia ini sendiri berada di pinggir jalan poros Balikpapan menuju Samarinda. Tepatnya beberapa meter dari pagar proyek infrastruktur nasional jalan Tol Balikpapan Samarinda di Jalan Soekarno Hatta km 13 Balikpapan.  tempat ini dulunya merupakan lokasi peristirahatan tentara Jepang saat ingin melarikan diri ke Samarinda dari kepungan tentara sekutu pada Perang Dunia II 1945 di Balikpapan.",WISATA SEJARAH,Kota Balikpapan,4.4,Sejarah,Gratis
50,TUGU PERINGATAN DEMONTRASI RAKYAT BALIKPAPAN KARANG ANYER,"Tugu Peringatan Demonstrasi 13 November 1945 di Kota Balikpapan Kalimantan Timur telah berpindah tempat.
Biasanya berada di dekat pertigaan lampu merah Karang Anyar Balikpapan atau dekat proyek kilang minyak, kini sudah dipindahkan ke Balai Gembira Balikpapan, Kalimantan Timur. 
Lokasinya tidak jauh dari tempat semula. ",WISATA SEJARAH,Kota Balikpapan,4,Sejarah,Gratis
51,PASAR INPRES KEBUN SAYUR,"Sekarang Pasar Inpres Kebun Sayur adalah salah satu destinasi wisata belanja di Balikpapan yang banyak dikunjungi wisatawan domestik maupun mancanegara. Di sini kita bisa memborong kalung, tas, baju, dompet, gelang, ikat kepala dari manik-manik, perisai, gantungan kunci, dan lain-lain. Tersedia beragam kaos bertuliskan Balikpapan dan Kalimantan Timur. Tak lupa, kita bisa menemukan kain-kain tenun, maupun kain motif untuk dijadikan pakaian di pasar ini. Harganya mulai dari puluhan ribu hingga jutaan rupiah.",WISATA BELANJA,Kota Balikpapan,4.4,Pasar,Gratis
52,PLAZA BALIKPAPAN,"Plaza Balikpapan adalah mal perbelanjaan pertama di Balikpapan, Kalimantan Timur yang didirikan pada tahun 1992. Mal ini terdiri dari 3 lantai. Plaza Balikpapan merupakan mal keluarga yang berkonsep menyediakan seluruh kebutuhan keluarga dalam satu tempat.",WISATA BELANJA,Kota Balikpapan,4.5,Mall,2000
53,BALIKPAPAN SUPER BLOK,"Balikpapan Super Block (BSB) beralamat di Jl. Jend. Sudirman (Jalan Jend.Sudirman) Balikpapan Kalimantan Timur. Balikpapan Superblock merupakan anak perusahaan dari PAM Group yang bergerak dibidang properti di gerbang Kalimantan Timur, Kota Balikpapan. Sebuah konsep yang memberikan Fasilitas beragam dan komersil, Mulai dari, supermarket, shopping center, sekolah bertaraf internasional, hunian keluarga eksklusif, Perhotelan Ekslusif, food center, tempat rekreasi, sport center, Klinik Kesehatan hingga entertainment yang saling terintegrasi dan mampu memudahkan dalam melakukan aktifitas di kawasan Balikpapan Superblock.",WISATA BELANJA,Kota Balikpapan,4.6,Mall,2000
54,ROTI TIAM,"Beralamat di Jl. MT Haryono No.83, Gn. Bahagia, Kecamatan Balikpapan Selatan, Kota Balikpapan, Kalimantan Timur 76114.  Terdapat menu makanan dan minuman dengan berbagai rasa dan harga yang juga bervariasi ",WISATA BELANJA,Kota Balikpapan,4.4,Oleh-Oleh,Gratis
